category,variable,text_title,text_source,text_body
General Enabling Environment,"Adult literacy rate, population 15+ years, both sexes (%)","UNESCO Institute for Statistics, UIS Database","Percentage of population aged 15 years and over who can both read and write – with understanding – a short simple statement on his/her everyday life. Generally, ‘literacy’ also encompasses ‘numeracy’, the ability to make simple arithmetic calculations. Adult illiteracy is defined as the percentage of the population aged 15 years and over who cannot both read and write – with understanding – a short simple statement on his/her everyday life."
General Enabling Environment,"Mean years of schooling (ISCED 1 or higher), population 25+ years, both sexes","UNESCO Institute for Statistics, UIS Database and Barro-Lee, Educational Attainment Dataset","Average number of completed years of education of a country's population aged 25 years and older, excluding years spent repeating individual grades."
General Enabling Environment,"GDP per capita, PPP (constant 2011 international $)","World Bank, World Development Indicators","GDP per capita based on purchasing power parity (PPP). PPP GDP is gross domestic product converted to international dollars using Purchasing Power Parity rates. An international dollar has the same purchasing power over GDP as the US dollar has in the United States. GDP at purchaser's prices is the sum of gross value added by all resident producers in the economy plus any product taxes and minus any subsidies not included in the value of the products. It is calculated without making deductions for depreciation of fabricated assets or for depletion and degradation of natural resources. Data are in constant 2011 international dollars."
General Enabling Environment,"Unemployment rate, 15+ (%)","International Labour Organisation (ILO), ILOSTAT Database","The unemployment rate is calculated by expressing the number of unemployed persons as a percentage of the total number of persons in the labour force. The labour force (formerly known as the economically active population) is the sum of the number of persons employed and the number of persons unemployed."
General Enabling Environment,"Share of youth not in employment, education or training (NEET) (%)","International Labour Organisation (ILO), ILOSTAT Database","The share of youth not in education, employment or training (also known as "the NEET rate") conveys the number of young persons not in education, employment or training as a percentage of the total youth population. It provides a measure of youth who are outside the educational system, not in training and not in employment, and thus serves as a broader measure of potential youth labour market entrants than youth unemployment, since it also includes young persons outside the labour force not in education or training."
General Enabling Environment,"Under-five mortality rate (probability of dying by age of 5 per 1000 live births)","World Health Organization (WHO), Global Health Observatory and UN DESA, World Population Prospects 2019","Probability (expressed as a rate per 1,000 live births) of a child born in a specific year or period dying before reaching the age of five years, if subject to age-specific mortality rates of that period. Numerator: deaths at age 0–5 years. Denominator: number of surviving children at beginning of specified age range during the 10 years prior to the survey."
General Enabling Environment,"Life expectancy at birth, both sexes (years)","World Health Organization (WHO), Global Health Observatory and UN DESA, World Population Prospects 2019","Average number of years that a new-born is expected to live if current mortality rates apply. Life expectancy at birth reflects the overall mortality level of a population. It summarizes the mortality pattern that prevails across all age groups: children and adolescents, adults and the elderly."
General Enabling Environment,"Total CO2 emissions excluding land-use change and forestry per capita (tCO2 per capita)","International Energy Agency (IEA), World Energy Balances 2019","For newly formed countries, the share of carbon emissions for the years prior to country formation is estimated based on each country’s carbon emissions in the five years immediately following its formation (or the first five years for which data are available). Per capita: shows the value per person for the countries/states/regions selected, based on the population data found within CAIT."
General Enabling Environment,"Energy intensity level of primary energy (MJ/2011 USD PPP)","World Bank, Sustainable Energy for All (SE4ALL) database from the SE4ALL Global Tracking Framework led jointly by the World Bank, International Energy Agency, and the Energy Sector Management Assistance Program","A ratio between energy supply and gross domestic product measured at purchasing power parity. Energy intensity is an indication of how much energy is used to produce one unit of economic output."
General Enabling Environment,"Renewable energy consumption (% of total final energy consumption)","World Bank, World Development Indicators from Sustainable Energy for All (SE4ALL) database from the SE4ALL Global Tracking Framework led jointly by the World Bank, International Energy Agency, and the Energy Sector Management Assistance Program","Renewable energy consumption is the share of renewable energy in total final energy consumption. Renewable energy consumption includes consumption of energy derived from: hydro, solid biofuels, wind, solar, liquid biofuels, biogas, geothermal, marine and waste."