category,variable,text_title,text_source,text_body
Information and Communications Technology,"Active mobile-broadband subscriptions per 100 inhabitants","International Telecommunication Union (ITU), ITU World Telecommunication/ICT Indicators Database","Active mobile-broadband subscriptions refers to the sum of standard mobile-broadband and dedicated mobile-broadband subscriptions to the public Internet. It covers actual subscribers, not potential subscribers. Even though the latter may have broadband enabled-handsets."
Information and Communications Technology,"Internet users (%)","International Telecommunication Union (ITU), ITU World Telecommunication/ICT Indicators Database","This indicator can include both estimates and survey data corresponding to the proportion of individuals using the Internet, based on results from national household surveys. The number should reflect the total population of the country - or at least individuals of 5 years and older. If this number is not available (i.e. target population reflects a more limited age group) an estimate for the entire population should be produced. If this is not possible at this stage, the age group reflected in the number (e.g. population aged 10+; population aged 15-74) should be indicated in a note. If no survey data are available at all, please provide an estimate was provided."
Information and Communications Technology,"Use of virtual social networks","World Economic Forum, Executive Opinion Surveys","Based on the survey question: In your country, how widely are virtual social networks used (e.g., Facebook, Twitter, LinkedIn)? [1 = not at all used; 7 = used extensively]."
Information and Communications Technology,"Business-to-consumer Internet use","World Economic Forum, Executive Opinion Surveys","Based on the survey question: In your country, to what extent do businesses use the Internet for selling their goods and services to consumers? [1 = not at all; 7 = to a great extent]."
Information and Communications Technology,"Firm-level technology absorption","World Economic Forum, Executive Opinion Surveys","Based on the survey question: In your country, to what extent do businesses adopt the latest technologies? [1 = not at all; 7 = to a great extent]."
Information and Communications Technology,"Government Online Service Index","UN DESA, UN E-Government Knowledgebase","This index assesses e-government development at the national level, based on data collected from an independent survey questionnaire that assesses the national online presence of all 193 United Nations Member States. The survey questionnaire assesses a number of features related to online service delivery, including whole-of-government approaches, open government data, e-participation, multi-channel service delivery, mobile services, usage up-take, digital divide as well as innovative partnerships through the use of ICT."
Information and Communications Technology,"Government success in ICT promotion","World Economic Forum, Executive Opinion Surveys","Based on the survey question: In your country, how successful is the government in promoting the use of ICTs? [1 = not successful at all; 7 = extremely successful]."
Information and Communications Technology,"Unlicensed software installation rates (%)","The Software Alliance (BSA), BSA Global Software Survey","A ratio of the amount of unlicensed software to the total amount of software installed. The amount of unlicensed software is determined by subtracting the quantity of software that was paid for or otherwise legally acquired during the year (such as through an open-source, free or complementary license), segmented by business and consumer usage from the quantity of PC software that was deployed during the year by consumers and business users."
Information and Communications Technology,"ICT PCT patents, applications/ million population","World Economic Forum, The Networked Readiness Index Historical Dataset based on WIPO PCT Data sourced from OECD Patent Database and World Bank, World Development Indicators","Number of applications for information and communications technology – related patents filed under the Patent Cooperation Treaty (PCT) per million population."
Information and Communications Technology,"Impact of ICTs on business models","World Economic Forum, Executive Opinion Surveys","Based on the survey question: In your country, to what extent do ICTs enable new business models? [1 = not at all; 7 = to a great extent]."
Information and Communications Technology,"Social impacts of ICT","World Economic Forum, The Network Readiness Index Historical Dataset 2012-2016, based on Executive Opinion Survey. 2018 values were recomputed using the same methodology based on updated values from the World Economic Forum Executive Opinion Survey 2018 and the United Nations E-Participation Index 2018","Social impacts is a pillar under the impact sub index of the Network Readiness Index which assesses a country's social progress brought about or enhanced by the use of ICTs. The pillar focuses on assessing the impact of ICT on access to basic services, education, government efficiency and citizens' engagement in public policymaking through e-government programs. It is composed of four variables, namely: Impact of ICTs on access to basic services, based on a survey question: In your country, to what extent do information and communication technologies (ICTs) enable access for all individuals to basic services (e.g., health, education, financial services, etc.)? [1 = not at all; 7 = to a great extent]. Internet access in schools, based on a survey question: In your country to what extent is the Internet used in schools for learning purposes? [1 = not at all; 7 = to a great extent]. ICT use and government efficiency, based on a survey question: In your country, to what extent does the use of ICTs by the government improve the quality of government services to the population? [1 = not at all; 7 = to a great extent]. E-Participation Index: the E-Participation Index assesses, on a 0-to-1 (best) scale, the quality, relevance and usefulness of government websites in providing online information and participatory tools and services to their citizens."
Economy,"Ease of starting a business","World Bank, Doing Business Database","Measures the paid-in minimum capital requirement, number of procedures, time and cost for a small- to medium-sized limited liability company to start up and formally operate in an economy’s largest business city. These procedures include the processes entrepreneurs undergo when obtaining all necessary approvals, licenses, permits and completing any required notifications, verifications or inscriptions for the company and employees with relevant authorities. The ranking of economies in terms of the ease of starting a business is determined by sorting their distance to frontier scores for starting a business. These scores are the simple average of the distance to frontier scores for each of the component indicators."
Economy,"Ease of enforcing a contract","World Bank, Doing Business Database","Measures the time and cost for resolving a commercial dispute through a local first-instance court, and the quality of judicial processes index, evaluating whether each economy has adopted a series of good practices that promote quality and efficiency in the court system. The data are collected through study of the codes of civil procedure and other court regulations as well as questionnaires completed by local litigation lawyers and judges. The ranking of economies on the ease of enforcing contracts is determined by sorting their distance to frontier scores for enforcing contracts. These scores are the simple average of the distance to frontier scores for each of the component indicators."
Economy,"Gross fixed capital formation (% of GDP)","World Bank, World Development Indicators","Gross fixed capital formation (formerly gross domestic fixed investment) includes land improvements (fences, ditches, drains, and so on); plant, machinery, and equipment purchases; and the construction of roads, railways and the like, including schools, offices, hospitals, private residential dwellings and commercial and industrial buildings. According to the 1993 SNA, net acquisitions of valuables are also considered capital formation."
Economy,"Logistics Performance Index","World Bank/International Bank for Reconstruction and Development, Logistics Performance Index dataset","The LPI is an interactive benchmarking tool created to help countries identify the challenges and opportunities they face in trade logistics and what they can do to improve their performance. It is a benchmarking tool developed by the World Bank that measures performance along the logistics supply chain within a country. Allowing for comparisons across 160 countries, the Index can help countries identify challenges and opportunities and improve their logistics performance. The LPI overall score reflects assessments of a country's logistics based on the efficiency of the customs clearance process, quality of trade- and transport-related infrastructure, ease of arranging competitively priced shipments, quality of logistics services, ability to track and trace consignments, and frequency with which shipments reach the consignee within the scheduled time. The Index ranges from 1 to 5, with a higher score representing better performance."
Economy,"Intensity of local competition","World Economic Forum, Executive Opinion Surveys","Based on the survey question: In your country, how intense is competition in the local markets? [1 = not intense at all; 7 = extremely intense]."
Economy,"Availability of latest technologies","World Economic Forum, Executive Opinion Surveys","Based on the survey question: In your country, to what extent are the latest technologies available? [1 = not at all; 7 = to a great extent]."
Economy,"Business impact of rules on FDI","World Economic Forum, Executive Opinion Surveys","Based on the survey question: In your country, how restrictive are rules and regulations on foreign direct investment (FDI)? [1 = extremely restrictive; 7 = not restrictive at all]."
Economy,"Foreign direct investment, net inflows (% of GDP)","Index team calculations based on World Bank, World Development Indicators","Foreign direct investment is the net inflow of investment to acquire a lasting management interest (10 percent or more of voting stock) in an enterprise operating in an economy other than that of the investor. It is the sum of equity capital, reinvestment of earnings, other long-term capital and short-term capital as shown in the balance of payments. This series shows net inflows (new investment inflows less disinvestment) in the reporting economy from foreign investors, and is divided by GDP. The variable is reported as a three-year average."
Economy,"Global Entrepreneurship Index","Global Entrepreneurship Development Institute, 2018 Global Entrepreneurship Index data","The Global Entrepreneurship Index is an annual index that measures the health of the entrepreneurship ecosystems in each of 137 countries. It then ranks the performance of these against each other. This provides a picture of how each country performs in both the domestic and international context."
Economy,"Annual investment in telecommunications services (% of GDP)","Index team calculations based on International Telecommunication Union (ITU), ITU World Telecommunication/ICT Indicators Database and World Bank, World Development Indicators","Annual investment in telecom services refers to the investment during the financial year made by entities providing telecommunication networks and/or services (including fixed, mobile and Internet services, as well as the transmission of TV signals) for acquiring or upgrading fixed assets (usually referred to as CAPEX), less disinvestment owing to disposals of fixed assets. Fixed assets should include tangible assets such as buildings and networks, and non-tangible assets such as computer software and intellectual property. The indicator is a measure of investment made by entities providing telecommunication networks and/or services in the country, and includes expenditure on initial installations and additions to existing installations where the usage is expected to be over an extended period of time. It excludes expenditure on fees for operating licenses and the use of radio spectrum, scaled by GDP in current US$. The variable is reported as a three-year average."
Economy,"Venture capital availability","World Economic Forum, Executive Opinion Surveys","Based on the survey question: In your country, how easy is it for start-up entrepreneurs with innovative but risky projects to obtain equity funding? [1 = extremely difficult; 7 = extremely easy]."
Economy,"High-technology net exports (% of total trade)","Index team calculations based on United Nations Comtrade, International Trade Statistics Database and on IMF, Balance of Payments and International Investment Position Statistics","High-technology exports minus re-exports expressed as a percentage of total trade. The list of commodities contains technical products with a high intensity of R&D, based on the Eurostat classification, itself based on SITC Rev.4 and the Organisation for Economic Co-operation and Development (OECD) definition. Commodities belong to the following sectors: aerospace; computers and office machines; electronics, telecommunications; pharmacy; scientific instruments; electrical machinery; chemistry; non- electrical machinery; and armaments. Total trade is the sum of exports and imports of goods and services excluding trade in government goods and services divided by 2."
Economy,"Exports of creative services (% of total trade in services)","United Nations Conference on Trade and Development (UNCTAD), UN secretarial calculations based on UN DESA Statistics Division, UN Comtrade","This variable presents exports of creative services by category of service, for individual economies, expressed as percentages of a country's total services trade."
Economy,"Values and shares of creative goods exports (% of total trade in goods)","United Nations Conference on Trade and Development (UNCTAD), UN secretarial calculations based on UN DESA Statistics Division, UN Comtrade","This variable presents exports of creative goods by individual countries, geographical regions and economic groups, expressed as percentages of a country's total goods trade and broken down by trading partner. The data are also presented as percentage of world (both as economy and trading partner), product totals and region."
Economy,"Trade (% of GDP)","World Bank, World Development Indicators","Trade is the sum of exports and imports of goods and services measured as a share of gross domestic product."
Economy,"Prevalence of non-tariff barriers","World Economic Forum, Executive Opinion Surveys","Based on the survey question: In your country, to what extent do non-tariff barriers (e.g., health and product standards, technical and labelling requirements, etc.) limit the ability of imported goods to compete in the domestic market? [1 = strongly limit; 7 = do not limit at all]."
Economy,"Total tax and contribution rate (% of profit)","World Bank, Doing Business Database","The total tax rate measures the amount of taxes and mandatory contributions borne by a business in the second year of operation, expressed as a share of commercial profit. Doing Business 2017 reports the total tax rate for calendar year 2015. The total amount of taxes borne is the sum of all the different taxes and contributions payable after accounting for allowable deductions and exemptions. The taxes withheld (such as personal income tax) or collected by the company and remitted to the tax authorities (such as VAT, sales tax or goods and service tax) but not borne by the company are excluded. The taxes included can be divided into five categories: profit or corporate income tax; social contributions and labour taxes paid by the employer (for which all mandatory contributions are included, even if paid to a private entity such as a requited pension fund); property taxes; turnover taxes; and other taxes (such as municipal fees and vehicle taxes). The total tax rate is designed to provide a comprehensive measure of the cost of all the taxes a business bears. It differs from the statutory tax rate, which merely provides the factor to be applied to the tax base. In computing the total tax rate, the actual tax payable is divided by commercial profit. Commercial profit is essentially net profit before all taxes borne. It differs from the conventional profit before tax reported in financial statements. In computing profit before tax, many of the taxes borne by a firm are deductible. In computing commercial profit, these taxes are not deductible. Commercial profit therefore presents a clear picture of the actual profit of a business before any of the taxes it bears in the course of the fiscal year. Commercial profit is computed as sales minus cost of goods sold, minus gross salaries, minus administrative expenses, minus other expenses, minus provisions, plus capital gains (from the sale of property) minus interest expense, plus interest income and minus commercial depreciation."
Economy,"Soundness of banks","World Economic Forum, Executive Opinion Surveys","Based on the survey question: In your country, how do you assess the soundness of banks? [1 = extremely low—banks may require recapitalization; 7 = extremely high—banks are generally healthy with sound balance sheets]." 
Economy,"Domestic credit to private sector (% of GDP)","World Bank, World Development Indicators based on IMF, International Financial Statistics and data files, World Bank and OECD","Domestic credit to private sector refers to financial resources provided to the private sector by financial corporations, such as through loans, purchases of nonequity securities and trade credits and other accounts receivable, that establish a claim for repayment. For some countries these claims include credit to public enterprises. Financial corporations include monetary authorities and deposit banks, as well as other financial corporations where data are available (including corporations that do not accept transferable deposits but do incur such liabilities as time and savings deposits). Examples of other financial corporations are finance and leasing companies, money lenders, insurance corporations, pension funds and foreign exchange companies. Credit to the private sector may sometimes include credit to state-owned or partially state-owned enterprises."
Economy,"Bank deposits to GDP (%)","World Bank, Global Financial Development Database","The total value of demand, time and saving deposits at domestic deposit money banks as a share of GDP. Deposit money banks comprise commercial banks and other financial institutions that accept transferable deposits, such as demand deposits. Demand, time and saving deposits in deposit money banks as a share of GDP is calculated using the following deflation method: {(0.5)*[Ft/P_et + Ft-1/P_et-1]}/[GDPt/P_at] where F is demand and time and saving deposits, P_e is end-of period CPI, and P_a is average annual CPI. Raw data are from the electronic version of the IMF’s International Financial Statistics. Bank deposits (IFS lines 24, 25, FOST and FOSD); GDP in local currency (IFS line NGDP); end-of period CPI (IFS line PCPI); and average annual CPI is calculated using the monthly CPI values (IFS line PCPI)."
Economy,"High-skilled employment share as a percentage of the total number of employed people (%)","Index team calculations based on International Labour Organisation (ILO), ILOSTAT Database","Employment comprises all persons of working age who during a specified brief period, such as one week or one day, were in the following categories: a) paid employment (whether at work or with a job but not at work); or b) self-employment (whether at work or with an enterprise but not at work). To favour international comparability, the working-age population is often defined as all persons aged 15 and older, but this may vary from country to country based on national laws and practices.  Information on occupation provides a description of the set of tasks and duties which are carried out by, or can be assigned to, one person. Employed persons are classified by occupations through their relationship to a present job. Skill levels 3 and 4 comprise managers, professionals and technicians and associate professionals based on the International Standard Classification of Occupation (ISCO-08)."
Economy,"Manufacturing, value added (% of GDP)","World Bank, World Development Indicators","Manufacturing refers to industries belonging to ISIC divisions 15-37. Value added is the net output of a sector after adding up all outputs and subtracting intermediate inputs. It is calculated without making deductions for depreciation of fabricated assets or depletion and degradation of natural resources."
General Enabling Environment,"Political stability and absence of violence/terrorism","World Bank, Worldwide Governance Indicators","Political stability and absence of violence/terrorism measures perceptions of the likelihood of political instability and/or politically-motivated violence, including terrorism."
General Enabling Environment,"Government effectiveness","World Bank, Worldwide Governance Indicators","Government effectiveness reflects perceptions of the quality of public services, the quality of the civil service and the degree of its independence from political pressures, the quality of policy formulation and implementation, and the credibility of the government's commitment to such policies. Estimate of governance (-2.5 (weak) to 2.5 (strong))."
General Enabling Environment,"Judicial independence","World Economic Forum, Executive Opinion Surveys","Based on the survey question: In your country, how independent is the judicial system from influences of the government, individuals, or companies? [1 = not independent at all; 7 = entirely independent]."
General Enabling Environment,"Regulatory quality","World Bank, Worldwide Governance Indicators","Regulatory quality reflects perceptions of the ability of the government to formulate and implement sound policies and regulations that permit and promote private sector development."
General Enabling Environment,"World Press Freedom Index","Reporters Without Borders, World Press Freedom Index","The World Press Freedom Index is an important advocacy tool based on the principle of emulation between states. The Index ranks 180 countries according to the level of freedom available to journalists. It is a snapshot of the media freedom situation based on an evaluation of pluralism, independence of the media, quality of legislative framework and safety of journalists in each country. It does not rank public policies, even if governments obviously have a major impact on their country’s ranking. Nor is it an indicator of the quality of journalism in each country. Countries have been given scores ranging from 0 to 100, with 0 being the best possible score and 100 the worst."
General Enabling Environment,"Women-to-men ratio in parliament (%)","Index team calculations based on Inter-Parliamentary Union, PARLINE Database","It is the percentage of women in parliament divided by the percentage of men in parliament. The percentage of women in parliament is based on the number of seats held by women members in single or lower chambers of national parliaments, expressed as a percentage of all occupied seats. It is derived by dividing the total number of seats occupied by women by the total number of seats in parliament. The percentage of men in parliament is derived by subtracting the percentage of women in parliament from 100."
General Enabling Environment,"Educational attainment: at least completed upper secondary (ISCED 3 or higher), population 25+ years, gender parity index (GPI)","UNESCO Institute for Statistics, UIS Database","Gender parity index (GPI) is the ratio of female to male values of a given variable. Educational attainment is the highest ISCED level of education an individual has successfully completed. This is usually measured with respect to the highest educational programme successfully completed, which is typically certified by a recognized qualification. Recognized intermediate qualifications are classified at a lower level than the programme itself."
General Enabling Environment,"Labour force participation rate, female-to-male ratio (15+)","Index team calculations based on International Labour Organisation (ILO), ILOSTAT Database","This is the ratio of female labour force participation to that of males. The labour force participation rate is a measure of the proportion of a country’s working-age population that engages actively in the labour market, either by working or looking for work; it provides an indication of the size of the supply of labour available to engage in the production of goods and services, relative to the working age population.  The labour force comprises all persons of working age who furnish the supply of labour for the production of goods and services during a specified time-reference period. It refers to the sum of all persons of working age who are employed and those who are unemployed."
